{
  "apiVersion": "agentic-sdlc-kit/v1",
  "threadId": "thread-small-web-01",
  "repository": "opal-portal",
  "revision": "a14be72",
  "entries": [
    {
      "service": "opal-web",
      "relation": "direct",
      "derivation": "observed",
      "sourceReferences": [
        {
          "id": "repository-map-small-web-01",
          "uri": "urn:groundtrail-example:repository-map-small-web-01",
          "digest": "6ea953fcd0efc336e01532e3c612b96e33ae37846cd4bc95b61f186285e6d47c"
        }
      ],
      "confidence": "high",
      "criticality": "low",
      "securityRelevant": false,
      "dataRelevant": false,
      "owner": "urn:groundtrail-example:owner:opal-web"
    }
  ],
  "unknowns": []
}
